{
  "schemaVersion": "1.0.0",
  "workItem": "G4-MOD-002",
  "referenceDate": "2026-09-22",
  "cases": [
    {
      "case_id": "pcb-mounts-to-base-positive",
      "name": "PCB module mounts to fixture base",
      "input": {
        "operation": "add_module",
        "ir": {
          "source": "contracts/g1/golden/reference-fixture.json"
        },
        "module": {
          "schemaVersion": "1.0.0",
          "module_id": "mod.pcb",
          "version": "1.0.0",
          "capability_level": "geometry_capable",
          "interfaces": [
            "board_outline"
          ],
          "clearance_envelopes": [],
          "geometry_generator_ref": "cad.pcb@1.0.0",
          "metadata": {
            "board_thickness_mm": {
              "value": 1.6,
              "provenance": [
                "datasheet.pcb@2026-09-22"
              ]
            }
          },
          "rule_refs": [
            "rp.pcb_dfm@1.0.0"
          ],
          "datasheet_refs": [
            "ds.pcb_rev_c@1.0.0"
          ]
        },
        "relationship": {
          "schemaVersion": "1.0.0",
          "relationship_id": "rel.pcb_mounts_base",
          "type": "mounts_to",
          "source": "COMP-PCB",
          "target": "COMP-FIXTURE-BASE",
          "parameters": {
            "fastener_ref": {
              "value": "mod.m3_fastener@2.0.0",
              "provenance": [
                "spec.pcb@2026-09-22"
              ]
            },
            "boss_ref": {
              "value": "face.base_mount_boss",
              "provenance": [
                "spec.pcb@2026-09-22"
              ]
            },
            "engagement_length_mm": {
              "value": 4.0,
              "provenance": [
                "datasheet.iso4762@2026-09-22"
              ]
            },
            "hole_alignment_tolerance_mm": {
              "value": 0.1,
              "provenance": [
                "datasheet.iso4762@2026-09-22"
              ]
            }
          },
          "provenance": [
            "spec.pcb@2026-09-22"
          ]
        }
      },
      "expect": {
        "valid": true,
        "changed": true,
        "addedComponentIds": [
          "COMP-PCB"
        ],
        "addedInterfaceIds": [
          "INT-COMP-PCB-COMP-FIXTURE-BASE-MOUNT"
        ],
        "addedRelationshipIds": [
          "REL-COMP-PCB-COMP-FIXTURE-BASE-MOUNTS"
        ],
        "addedConstraintIds": [
          "CON-COMP-PCB-MOUNT"
        ],
        "addedUnknownIds": [],
        "blockedConstraintKinds": [],
        "fabricatedValuesUsed": false,
        "upgradeBlocked": false,
        "pinnedModules": [
          [
            "mod.pcb",
            "1.0.0"
          ]
        ]
      }
    },
    {
      "case_id": "usbc-opens-through-cover-positive",
      "name": "USB-C module opens through the cover wall",
      "input": {
        "operation": "add_module",
        "ir": {
          "source": "contracts/g1/golden/reference-fixture.json"
        },
        "module": {
          "schemaVersion": "1.0.0",
          "module_id": "mod.usbc",
          "version": "1.0.0",
          "capability_level": "layout_capable",
          "interfaces": [
            "usbc_receptacle"
          ],
          "clearance_envelopes": [],
          "metadata": {
            "receptacle_depth_mm": {
              "value": 8.0,
              "provenance": [
                "datasheet.usbc@2026-09-22"
              ]
            }
          },
          "rule_refs": [],
          "datasheet_refs": [
            "ds.usbc@1.0.0"
          ]
        },
        "relationship": {
          "schemaVersion": "1.0.0",
          "relationship_id": "rel.usbc_opens_wall",
          "type": "opens_through",
          "source": "COMP-USBC",
          "target": "COMP-FIXTURE-COVER",
          "parameters": {
            "opening_ref": {
              "value": "opening.cover_usbc",
              "provenance": [
                "spec.enclosure@2026-09-22"
              ]
            },
            "interface_envelope_ref": {
              "value": "env.usbc_cavity@1.0.0",
              "provenance": [
                "datasheet.usbc@2026-09-22"
              ]
            },
            "clearance_gap_mm": {
              "value": 0.5,
              "provenance": [
                "datasheet.usbc@2026-09-22"
              ]
            }
          },
          "provenance": [
            "spec.enclosure@2026-09-22"
          ]
        }
      },
      "expect": {
        "valid": true,
        "changed": true,
        "addedComponentIds": [
          "COMP-USBC"
        ],
        "addedInterfaceIds": [
          "INT-COMP-USBC-COMP-FIXTURE-COVER-OPENING"
        ],
        "addedRelationshipIds": [
          "REL-COMP-USBC-COMP-FIXTURE-COVER-OPENINGS"
        ],
        "addedConstraintIds": [
          "CON-COMP-USBC-OPENING"
        ],
        "addedUnknownIds": [],
        "blockedConstraintKinds": [],
        "fabricatedValuesUsed": false,
        "upgradeBlocked": false,
        "pinnedModules": [
          [
            "mod.usbc",
            "1.0.0"
          ]
        ]
      }
    },
    {
      "case_id": "m3-fastens-to-base-positive",
      "name": "M3 fastener module fastens the base",
      "input": {
        "operation": "add_module",
        "ir": {
          "source": "contracts/g1/golden/reference-fixture.json"
        },
        "module": {
          "schemaVersion": "1.0.0",
          "module_id": "mod.m3_fastener",
          "version": "2.0.0",
          "capability_level": "metadata_only",
          "interfaces": [],
          "clearance_envelopes": [],
          "metadata": {
            "source": {
              "value": "iso4762_catalog",
              "provenance": [
                "datasheet.iso4762@2026-09-22"
              ]
            }
          },
          "rule_refs": [],
          "datasheet_refs": [
            "ds.iso4762@2.0.0"
          ]
        },
        "relationship": {
          "schemaVersion": "1.0.0",
          "relationship_id": "rel.m3_fastens_base",
          "type": "fastens",
          "source": "COMP-M3-FASTENER",
          "target": "COMP-FIXTURE-BASE",
          "parameters": {
            "screw_length_mm": {
              "value": 6.0,
              "provenance": [
                "datasheet.iso4762@2026-09-22"
              ]
            },
            "through_hole_ref": {
              "value": "hole.base_through",
              "provenance": [
                "spec.base@2026-09-22"
              ]
            },
            "thread_ref": {
              "value": "thread.base_thread_insert",
              "provenance": [
                "spec.base@2026-09-22"
              ]
            }
          },
          "provenance": [
            "datasheet.iso4762@2026-09-22"
          ]
        }
      },
      "expect": {
        "valid": true,
        "changed": true,
        "addedComponentIds": [
          "COMP-M3-FASTENER"
        ],
        "addedInterfaceIds": [
          "INT-COMP-M3-FASTENER-COMP-FIXTURE-BASE-MOUNT"
        ],
        "addedRelationshipIds": [
          "REL-COMP-M3-FASTENER-COMP-FIXTURE-BASE-FASTENERS"
        ],
        "addedConstraintIds": [
          "CON-COMP-M3-FASTENER-FASTENER"
        ],
        "addedUnknownIds": [],
        "blockedConstraintKinds": [],
        "fabricatedValuesUsed": false,
        "upgradeBlocked": false,
        "pinnedModules": [
          [
            "mod.m3_fastener",
            "2.0.0"
          ]
        ]
      }
    },
    {
      "case_id": "pcb-clears-cover-positive",
      "name": "PCB module clears the cover wall",
      "input": {
        "operation": "add_module",
        "ir": {
          "source": "contracts/g1/golden/reference-fixture.json"
        },
        "module": {
          "schemaVersion": "1.0.0",
          "module_id": "mod.pcb",
          "version": "1.0.0",
          "capability_level": "geometry_capable",
          "interfaces": [
            "board_outline"
          ],
          "clearance_envelopes": [],
          "geometry_generator_ref": "cad.pcb@1.0.0",
          "metadata": {
            "board_thickness_mm": {
              "value": 1.6,
              "provenance": [
                "datasheet.pcb@2026-09-22"
              ]
            }
          },
          "rule_refs": [],
          "datasheet_refs": [
            "ds.pcb_rev_c@1.0.0"
          ]
        },
        "relationship": {
          "schemaVersion": "1.0.0",
          "relationship_id": "rel.pcb_clears_cover",
          "type": "clears",
          "source": "COMP-PCB",
          "target": "COMP-FIXTURE-COVER",
          "parameters": {
            "minimum_distance_mm": {
              "value": 2.0,
              "provenance": [
                "spec.layout@2026-09-22"
              ]
            }
          },
          "provenance": [
            "spec.layout@2026-09-22"
          ]
        }
      },
      "expect": {
        "valid": true,
        "changed": true,
        "addedComponentIds": [
          "COMP-PCB"
        ],
        "addedInterfaceIds": [],
        "addedRelationshipIds": [
          "REL-COMP-PCB-COMP-FIXTURE-COVER-CLEARANCES"
        ],
        "addedConstraintIds": [
          "CON-COMP-PCB-CLEARANCE"
        ],
        "addedUnknownIds": [],
        "blockedConstraintKinds": [],
        "fabricatedValuesUsed": false,
        "upgradeBlocked": false,
        "pinnedModules": [
          [
            "mod.pcb",
            "1.0.0"
          ]
        ]
      }
    },
    {
      "case_id": "enclosure-contains-pcb-positive",
      "name": "Enclosure module contains the reference PCB",
      "input": {
        "operation": "add_module",
        "ir": {
          "source": "contracts/g1/golden/reference-fixture.json"
        },
        "module": {
          "schemaVersion": "1.0.0",
          "module_id": "mod.enclosure",
          "version": "1.0.0",
          "capability_level": "layout_capable",